{
  "schema": "workstream_boundary_receipt_v1",
  "workspace_authority_id": "workspace",
  "stream_id": "ws",
  "reservation_id": "reservation",
  "outcome": "archived",
  "expected_stream_cut": "line-1",
  "expected_main_cut": "main-1",
  "proposed_main_cut": "main-2",
  "main_ref_position": 2,
  "ref_receipt_handle": "sha256:97d42f66d55a10101283cafb6849296c",
  "recorded_at": "t4"
}
